

================================================================
== Vivado HLS Report for 'sigmoid'
================================================================
* Date:           Fri Nov 25 11:49:16 2022

* Version:        2019.2 (Build 2704478 on Wed Nov 06 22:10:23 MST 2019)
* Project:        LSTM
* Solution:       solution1
* Product family: zynq
* Target device:  xc7z020-clg400-1


================================================================
== Performance Estimates
================================================================
+ Timing: 
    * Summary: 
    +--------+----------+----------+------------+
    |  Clock |  Target  | Estimated| Uncertainty|
    +--------+----------+----------+------------+
    |ap_clk  | 10.00 ns | 8.683 ns |   1.25 ns  |
    +--------+----------+----------+------------+

+ Latency: 
    * Summary: 
    +---------+---------+----------+----------+-----+-----+---------+
    |  Latency (cycles) |  Latency (absolute) |  Interval | Pipeline|
    |   min   |   max   |    min   |    max   | min | max |   Type  |
    +---------+---------+----------+----------+-----+-----+---------+
    |      123|      123| 1.230 us | 1.230 us |  123|  123|   none  |
    +---------+---------+----------+----------+-----+-----+---------+

    + Detail: 
        * Instance: 
        N/A

        * Loop: 
        +----------+---------+---------+----------+-----------+-----------+------+----------+
        |          |  Latency (cycles) | Iteration|  Initiation Interval  | Trip |          |
        | Loop Name|   min   |   max   |  Latency |  achieved |   target  | Count| Pipelined|
        +----------+---------+---------+----------+-----------+-----------+------+----------+
        |- i_loop  |      121|      121|        59|          1|          1|    64|    yes   |
        +----------+---------+---------+----------+-----------+-----------+------+----------+

============================================================
+ Verbose Summary: Synthesis Manager
============================================================
InlineROM: 1
ExposeGlobal: 0
============================================================
+ Verbose Summary: CDFG Model
============================================================
IsTopModel: 0
ResetActiveHigh: 1
IsCombinational: 0
IsDatapathOnly: 0
HasWiredReturn: 1
HasMFsm: 0
HasVarLatency: 1
IsPipeline: 0
IsRtlPipelined: 0
IsInstanceOverlapped: 0
IsDontTouch: 0
HasImplIP: 0
IsGatedGlobalClock: 0

+ Individual pipeline summary: 
  * Pipeline-0: initiation interval (II) = 1, depth = 59


============================================================
+ Verbose Summary: Schedule
============================================================
* Number of FSM states : 61
* Pipeline : 1
  Pipeline-0 : II = 1, D = 59, States = { 2 3 4 5 6 7 8 9 10 11 12 13 14 15 16 17 18 19 20 21 22 23 24 25 26 27 28 29 30 31 32 33 34 35 36 37 38 39 40 41 42 43 44 45 46 47 48 49 50 51 52 53 54 55 56 57 58 59 60 }
* Dataflow Pipeline: 0

* FSM state transitions: 
1 --> 2 
2 --> 61 3 
3 --> 4 
4 --> 5 
5 --> 6 
6 --> 7 
7 --> 8 
8 --> 9 
9 --> 10 
10 --> 11 
11 --> 12 
12 --> 13 
13 --> 14 
14 --> 15 
15 --> 16 
16 --> 17 
17 --> 18 
18 --> 19 
19 --> 20 
20 --> 21 
21 --> 22 
22 --> 23 
23 --> 24 
24 --> 25 
25 --> 26 
26 --> 27 
27 --> 28 
28 --> 29 
29 --> 30 
30 --> 31 
31 --> 32 
32 --> 33 
33 --> 34 
34 --> 35 
35 --> 36 
36 --> 37 
37 --> 38 
38 --> 39 
39 --> 40 
40 --> 41 
41 --> 42 
42 --> 43 
43 --> 44 
44 --> 45 
45 --> 46 
46 --> 47 
47 --> 48 
48 --> 49 
49 --> 50 
50 --> 51 
51 --> 52 
52 --> 53 
53 --> 54 
54 --> 55 
55 --> 56 
56 --> 57 
57 --> 58 
58 --> 59 
59 --> 60 
60 --> 2 
61 --> 

* FSM state operations: 

State 1 <SV = 0> <Delay = 1.76>
ST_1 : Operation 62 [1/1] (1.76ns)   --->   "br label %1" [LSTM/rnn.cpp:76]   --->   Operation 62 'br' <Predicate = true> <Delay = 1.76>

State 2 <SV = 1> <Delay = 3.25>
ST_2 : Operation 63 [1/1] (0.00ns)   --->   "%i_0 = phi i7 [ 0, %0 ], [ %i, %i_loop ]"   --->   Operation 63 'phi' 'i_0' <Predicate = true> <Delay = 0.00>
ST_2 : Operation 64 [1/1] (1.48ns)   --->   "%icmp_ln76 = icmp eq i7 %i_0, -64" [LSTM/rnn.cpp:76]   --->   Operation 64 'icmp' 'icmp_ln76' <Predicate = true> <Delay = 1.48> <Core = "Cmp">   --->   Core 25 'Cmp' <Latency = 0> <II = 1> <Delay = 1.48> <FuncUnit> <Opcode : 'icmp'> <InPorts = 2> <OutPorts = 1>
ST_2 : Operation 65 [1/1] (0.00ns)   --->   "%empty = call i32 (...)* @_ssdm_op_SpecLoopTripCount(i64 64, i64 64, i64 64)"   --->   Operation 65 'speclooptripcount' 'empty' <Predicate = true> <Delay = 0.00>
ST_2 : Operation 66 [1/1] (1.87ns)   --->   "%i = add i7 %i_0, 1" [LSTM/rnn.cpp:76]   --->   Operation 66 'add' 'i' <Predicate = true> <Delay = 1.87> <Core = "AddSub">   --->   Core 14 'AddSub' <Latency = 0> <II = 1> <Delay = 1.87> <FuncUnit> <Opcode : 'add' 'sub'> <InPorts = 2> <OutPorts = 1>
ST_2 : Operation 67 [1/1] (0.00ns)   --->   "br i1 %icmp_ln76, label %2, label %i_loop" [LSTM/rnn.cpp:76]   --->   Operation 67 'br' <Predicate = true> <Delay = 0.00>
ST_2 : Operation 68 [1/1] (0.00ns)   --->   "%zext_ln79 = zext i7 %i_0 to i64" [LSTM/rnn.cpp:79]   --->   Operation 68 'zext' 'zext_ln79' <Predicate = (!icmp_ln76)> <Delay = 0.00>
ST_2 : Operation 69 [1/1] (0.00ns)   --->   "%a_addr = getelementptr [64 x float]* %a, i64 0, i64 %zext_ln79" [LSTM/rnn.cpp:79]   --->   Operation 69 'getelementptr' 'a_addr' <Predicate = (!icmp_ln76)> <Delay = 0.00>
ST_2 : Operation 70 [2/2] (3.25ns)   --->   "%a_load = load float* %a_addr, align 4" [LSTM/rnn.cpp:79]   --->   Operation 70 'load' 'a_load' <Predicate = (!icmp_ln76)> <Delay = 3.25> <Core = "RAM">   --->   Core 37 'RAM' <Latency = 1> <II = 1> <Delay = 3.25> <Storage> <Opcode : 'load' 'store'> <Ports = 2> <Width = 32> <Depth = 64> <RAM>

State 3 <SV = 2> <Delay = 8.68>
ST_3 : Operation 71 [1/2] (3.25ns)   --->   "%a_load = load float* %a_addr, align 4" [LSTM/rnn.cpp:79]   --->   Operation 71 'load' 'a_load' <Predicate = (!icmp_ln76)> <Delay = 3.25> <Core = "RAM">   --->   Core 37 'RAM' <Latency = 1> <II = 1> <Delay = 3.25> <Storage> <Opcode : 'load' 'store'> <Ports = 2> <Width = 32> <Depth = 64> <RAM>
ST_3 : Operation 72 [1/1] (0.00ns)   --->   "%bitcast_ln79 = bitcast float %a_load to i32" [LSTM/rnn.cpp:79]   --->   Operation 72 'bitcast' 'bitcast_ln79' <Predicate = (!icmp_ln76)> <Delay = 0.00>
ST_3 : Operation 73 [1/1] (0.99ns)   --->   "%xor_ln79 = xor i32 %bitcast_ln79, -2147483648" [LSTM/rnn.cpp:79]   --->   Operation 73 'xor' 'xor_ln79' <Predicate = (!icmp_ln76)> <Delay = 0.99> <Core = "LogicGate">   --->   Core 27 'LogicGate' <Latency = 0> <II = 1> <Delay = 0.99> <FuncUnit> <Opcode : 'and' 'or' 'xor'> <InPorts = 2> <OutPorts = 1>
ST_3 : Operation 74 [1/1] (0.00ns)   --->   "%bitcast_ln79_1 = bitcast i32 %xor_ln79 to float" [LSTM/rnn.cpp:79]   --->   Operation 74 'bitcast' 'bitcast_ln79_1' <Predicate = (!icmp_ln76)> <Delay = 0.00>
ST_3 : Operation 75 [2/2] (4.43ns)   --->   "%tmp_9 = fpext float %bitcast_ln79_1 to double" [LSTM/rnn.cpp:79]   --->   Operation 75 'fpext' 'tmp_9' <Predicate = (!icmp_ln76)> <Delay = 4.43> <Core = "Float2Double">   --->   Core 114 'Float2Double' <Latency = 1> <II = 1> <Delay = 4.43> <FuncUnit> <Opcode : 'fpext'> <InPorts = 1> <OutPorts = 1>

State 4 <SV = 3> <Delay = 4.43>
ST_4 : Operation 76 [1/2] (4.43ns)   --->   "%tmp_9 = fpext float %bitcast_ln79_1 to double" [LSTM/rnn.cpp:79]   --->   Operation 76 'fpext' 'tmp_9' <Predicate = (!icmp_ln76)> <Delay = 4.43> <Core = "Float2Double">   --->   Core 114 'Float2Double' <Latency = 1> <II = 1> <Delay = 4.43> <FuncUnit> <Opcode : 'fpext'> <InPorts = 1> <OutPorts = 1>

State 5 <SV = 4> <Delay = 7.32>
ST_5 : Operation 77 [18/18] (7.32ns)   --->   "%tmp_s = call double @llvm.exp.f64(double %tmp_9)" [LSTM/rnn.cpp:79]   --->   Operation 77 'dexp' 'tmp_s' <Predicate = (!icmp_ln76)> <Delay = 7.32> <Core = "DExp">   --->   Core 128 'DExp' <Latency = 17> <II = 1> <Delay = 7.32> <FuncUnit> <Opcode : 'dexp'> <InPorts = 1> <OutPorts = 1>

State 6 <SV = 5> <Delay = 7.32>
ST_6 : Operation 78 [17/18] (7.32ns)   --->   "%tmp_s = call double @llvm.exp.f64(double %tmp_9)" [LSTM/rnn.cpp:79]   --->   Operation 78 'dexp' 'tmp_s' <Predicate = (!icmp_ln76)> <Delay = 7.32> <Core = "DExp">   --->   Core 128 'DExp' <Latency = 17> <II = 1> <Delay = 7.32> <FuncUnit> <Opcode : 'dexp'> <InPorts = 1> <OutPorts = 1>

State 7 <SV = 6> <Delay = 7.32>
ST_7 : Operation 79 [16/18] (7.32ns)   --->   "%tmp_s = call double @llvm.exp.f64(double %tmp_9)" [LSTM/rnn.cpp:79]   --->   Operation 79 'dexp' 'tmp_s' <Predicate = (!icmp_ln76)> <Delay = 7.32> <Core = "DExp">   --->   Core 128 'DExp' <Latency = 17> <II = 1> <Delay = 7.32> <FuncUnit> <Opcode : 'dexp'> <InPorts = 1> <OutPorts = 1>

State 8 <SV = 7> <Delay = 7.32>
ST_8 : Operation 80 [15/18] (7.32ns)   --->   "%tmp_s = call double @llvm.exp.f64(double %tmp_9)" [LSTM/rnn.cpp:79]   --->   Operation 80 'dexp' 'tmp_s' <Predicate = (!icmp_ln76)> <Delay = 7.32> <Core = "DExp">   --->   Core 128 'DExp' <Latency = 17> <II = 1> <Delay = 7.32> <FuncUnit> <Opcode : 'dexp'> <InPorts = 1> <OutPorts = 1>

State 9 <SV = 8> <Delay = 7.32>
ST_9 : Operation 81 [14/18] (7.32ns)   --->   "%tmp_s = call double @llvm.exp.f64(double %tmp_9)" [LSTM/rnn.cpp:79]   --->   Operation 81 'dexp' 'tmp_s' <Predicate = (!icmp_ln76)> <Delay = 7.32> <Core = "DExp">   --->   Core 128 'DExp' <Latency = 17> <II = 1> <Delay = 7.32> <FuncUnit> <Opcode : 'dexp'> <InPorts = 1> <OutPorts = 1>

State 10 <SV = 9> <Delay = 7.32>
ST_10 : Operation 82 [13/18] (7.32ns)   --->   "%tmp_s = call double @llvm.exp.f64(double %tmp_9)" [LSTM/rnn.cpp:79]   --->   Operation 82 'dexp' 'tmp_s' <Predicate = (!icmp_ln76)> <Delay = 7.32> <Core = "DExp">   --->   Core 128 'DExp' <Latency = 17> <II = 1> <Delay = 7.32> <FuncUnit> <Opcode : 'dexp'> <InPorts = 1> <OutPorts = 1>

State 11 <SV = 10> <Delay = 7.32>
ST_11 : Operation 83 [12/18] (7.32ns)   --->   "%tmp_s = call double @llvm.exp.f64(double %tmp_9)" [LSTM/rnn.cpp:79]   --->   Operation 83 'dexp' 'tmp_s' <Predicate = (!icmp_ln76)> <Delay = 7.32> <Core = "DExp">   --->   Core 128 'DExp' <Latency = 17> <II = 1> <Delay = 7.32> <FuncUnit> <Opcode : 'dexp'> <InPorts = 1> <OutPorts = 1>

State 12 <SV = 11> <Delay = 7.32>
ST_12 : Operation 84 [11/18] (7.32ns)   --->   "%tmp_s = call double @llvm.exp.f64(double %tmp_9)" [LSTM/rnn.cpp:79]   --->   Operation 84 'dexp' 'tmp_s' <Predicate = (!icmp_ln76)> <Delay = 7.32> <Core = "DExp">   --->   Core 128 'DExp' <Latency = 17> <II = 1> <Delay = 7.32> <FuncUnit> <Opcode : 'dexp'> <InPorts = 1> <OutPorts = 1>

State 13 <SV = 12> <Delay = 7.32>
ST_13 : Operation 85 [10/18] (7.32ns)   --->   "%tmp_s = call double @llvm.exp.f64(double %tmp_9)" [LSTM/rnn.cpp:79]   --->   Operation 85 'dexp' 'tmp_s' <Predicate = (!icmp_ln76)> <Delay = 7.32> <Core = "DExp">   --->   Core 128 'DExp' <Latency = 17> <II = 1> <Delay = 7.32> <FuncUnit> <Opcode : 'dexp'> <InPorts = 1> <OutPorts = 1>

State 14 <SV = 13> <Delay = 7.32>
ST_14 : Operation 86 [9/18] (7.32ns)   --->   "%tmp_s = call double @llvm.exp.f64(double %tmp_9)" [LSTM/rnn.cpp:79]   --->   Operation 86 'dexp' 'tmp_s' <Predicate = (!icmp_ln76)> <Delay = 7.32> <Core = "DExp">   --->   Core 128 'DExp' <Latency = 17> <II = 1> <Delay = 7.32> <FuncUnit> <Opcode : 'dexp'> <InPorts = 1> <OutPorts = 1>

State 15 <SV = 14> <Delay = 7.32>
ST_15 : Operation 87 [8/18] (7.32ns)   --->   "%tmp_s = call double @llvm.exp.f64(double %tmp_9)" [LSTM/rnn.cpp:79]   --->   Operation 87 'dexp' 'tmp_s' <Predicate = (!icmp_ln76)> <Delay = 7.32> <Core = "DExp">   --->   Core 128 'DExp' <Latency = 17> <II = 1> <Delay = 7.32> <FuncUnit> <Opcode : 'dexp'> <InPorts = 1> <OutPorts = 1>

State 16 <SV = 15> <Delay = 7.32>
ST_16 : Operation 88 [7/18] (7.32ns)   --->   "%tmp_s = call double @llvm.exp.f64(double %tmp_9)" [LSTM/rnn.cpp:79]   --->   Operation 88 'dexp' 'tmp_s' <Predicate = (!icmp_ln76)> <Delay = 7.32> <Core = "DExp">   --->   Core 128 'DExp' <Latency = 17> <II = 1> <Delay = 7.32> <FuncUnit> <Opcode : 'dexp'> <InPorts = 1> <OutPorts = 1>

State 17 <SV = 16> <Delay = 7.32>
ST_17 : Operation 89 [6/18] (7.32ns)   --->   "%tmp_s = call double @llvm.exp.f64(double %tmp_9)" [LSTM/rnn.cpp:79]   --->   Operation 89 'dexp' 'tmp_s' <Predicate = (!icmp_ln76)> <Delay = 7.32> <Core = "DExp">   --->   Core 128 'DExp' <Latency = 17> <II = 1> <Delay = 7.32> <FuncUnit> <Opcode : 'dexp'> <InPorts = 1> <OutPorts = 1>

State 18 <SV = 17> <Delay = 7.32>
ST_18 : Operation 90 [5/18] (7.32ns)   --->   "%tmp_s = call double @llvm.exp.f64(double %tmp_9)" [LSTM/rnn.cpp:79]   --->   Operation 90 'dexp' 'tmp_s' <Predicate = (!icmp_ln76)> <Delay = 7.32> <Core = "DExp">   --->   Core 128 'DExp' <Latency = 17> <II = 1> <Delay = 7.32> <FuncUnit> <Opcode : 'dexp'> <InPorts = 1> <OutPorts = 1>

State 19 <SV = 18> <Delay = 7.32>
ST_19 : Operation 91 [4/18] (7.32ns)   --->   "%tmp_s = call double @llvm.exp.f64(double %tmp_9)" [LSTM/rnn.cpp:79]   --->   Operation 91 'dexp' 'tmp_s' <Predicate = (!icmp_ln76)> <Delay = 7.32> <Core = "DExp">   --->   Core 128 'DExp' <Latency = 17> <II = 1> <Delay = 7.32> <FuncUnit> <Opcode : 'dexp'> <InPorts = 1> <OutPorts = 1>

State 20 <SV = 19> <Delay = 7.32>
ST_20 : Operation 92 [3/18] (7.32ns)   --->   "%tmp_s = call double @llvm.exp.f64(double %tmp_9)" [LSTM/rnn.cpp:79]   --->   Operation 92 'dexp' 'tmp_s' <Predicate = (!icmp_ln76)> <Delay = 7.32> <Core = "DExp">   --->   Core 128 'DExp' <Latency = 17> <II = 1> <Delay = 7.32> <FuncUnit> <Opcode : 'dexp'> <InPorts = 1> <OutPorts = 1>

State 21 <SV = 20> <Delay = 7.32>
ST_21 : Operation 93 [2/18] (7.32ns)   --->   "%tmp_s = call double @llvm.exp.f64(double %tmp_9)" [LSTM/rnn.cpp:79]   --->   Operation 93 'dexp' 'tmp_s' <Predicate = (!icmp_ln76)> <Delay = 7.32> <Core = "DExp">   --->   Core 128 'DExp' <Latency = 17> <II = 1> <Delay = 7.32> <FuncUnit> <Opcode : 'dexp'> <InPorts = 1> <OutPorts = 1>

State 22 <SV = 21> <Delay = 7.32>
ST_22 : Operation 94 [1/18] (7.32ns)   --->   "%tmp_s = call double @llvm.exp.f64(double %tmp_9)" [LSTM/rnn.cpp:79]   --->   Operation 94 'dexp' 'tmp_s' <Predicate = (!icmp_ln76)> <Delay = 7.32> <Core = "DExp">   --->   Core 128 'DExp' <Latency = 17> <II = 1> <Delay = 7.32> <FuncUnit> <Opcode : 'dexp'> <InPorts = 1> <OutPorts = 1>

State 23 <SV = 22> <Delay = 8.23>
ST_23 : Operation 95 [5/5] (8.23ns)   --->   "%tmp_1 = fadd double %tmp_s, 1.000000e+00" [LSTM/rnn.cpp:79]   --->   Operation 95 'dadd' 'tmp_1' <Predicate = (!icmp_ln76)> <Delay = 8.23> <Core = "DAddSub">   --->   Core 115 'DAddSub' <Latency = 4> <II = 1> <Delay = 8.23> <FuncUnit> <Opcode : 'dadd' 'dsub'> <InPorts = 2> <OutPorts = 1>

State 24 <SV = 23> <Delay = 8.23>
ST_24 : Operation 96 [4/5] (8.23ns)   --->   "%tmp_1 = fadd double %tmp_s, 1.000000e+00" [LSTM/rnn.cpp:79]   --->   Operation 96 'dadd' 'tmp_1' <Predicate = (!icmp_ln76)> <Delay = 8.23> <Core = "DAddSub">   --->   Core 115 'DAddSub' <Latency = 4> <II = 1> <Delay = 8.23> <FuncUnit> <Opcode : 'dadd' 'dsub'> <InPorts = 2> <OutPorts = 1>

State 25 <SV = 24> <Delay = 8.23>
ST_25 : Operation 97 [3/5] (8.23ns)   --->   "%tmp_1 = fadd double %tmp_s, 1.000000e+00" [LSTM/rnn.cpp:79]   --->   Operation 97 'dadd' 'tmp_1' <Predicate = (!icmp_ln76)> <Delay = 8.23> <Core = "DAddSub">   --->   Core 115 'DAddSub' <Latency = 4> <II = 1> <Delay = 8.23> <FuncUnit> <Opcode : 'dadd' 'dsub'> <InPorts = 2> <OutPorts = 1>

State 26 <SV = 25> <Delay = 8.23>
ST_26 : Operation 98 [2/5] (8.23ns)   --->   "%tmp_1 = fadd double %tmp_s, 1.000000e+00" [LSTM/rnn.cpp:79]   --->   Operation 98 'dadd' 'tmp_1' <Predicate = (!icmp_ln76)> <Delay = 8.23> <Core = "DAddSub">   --->   Core 115 'DAddSub' <Latency = 4> <II = 1> <Delay = 8.23> <FuncUnit> <Opcode : 'dadd' 'dsub'> <InPorts = 2> <OutPorts = 1>

State 27 <SV = 26> <Delay = 8.23>
ST_27 : Operation 99 [1/5] (8.23ns)   --->   "%tmp_1 = fadd double %tmp_s, 1.000000e+00" [LSTM/rnn.cpp:79]   --->   Operation 99 'dadd' 'tmp_1' <Predicate = (!icmp_ln76)> <Delay = 8.23> <Core = "DAddSub">   --->   Core 115 'DAddSub' <Latency = 4> <II = 1> <Delay = 8.23> <FuncUnit> <Opcode : 'dadd' 'dsub'> <InPorts = 2> <OutPorts = 1>

State 28 <SV = 27> <Delay = 8.62>
ST_28 : Operation 100 [31/31] (8.62ns)   --->   "%tmp_2 = fdiv double 1.000000e+00, %tmp_1" [LSTM/rnn.cpp:79]   --->   Operation 100 'ddiv' 'tmp_2' <Predicate = (!icmp_ln76)> <Delay = 8.62> <Core = "DDiv">   --->   Core 117 'DDiv' <Latency = 30> <II = 1> <Delay = 8.62> <FuncUnit> <Opcode : 'ddiv' 'drem'> <InPorts = 2> <OutPorts = 1>

State 29 <SV = 28> <Delay = 8.62>
ST_29 : Operation 101 [30/31] (8.62ns)   --->   "%tmp_2 = fdiv double 1.000000e+00, %tmp_1" [LSTM/rnn.cpp:79]   --->   Operation 101 'ddiv' 'tmp_2' <Predicate = (!icmp_ln76)> <Delay = 8.62> <Core = "DDiv">   --->   Core 117 'DDiv' <Latency = 30> <II = 1> <Delay = 8.62> <FuncUnit> <Opcode : 'ddiv' 'drem'> <InPorts = 2> <OutPorts = 1>

State 30 <SV = 29> <Delay = 8.62>
ST_30 : Operation 102 [29/31] (8.62ns)   --->   "%tmp_2 = fdiv double 1.000000e+00, %tmp_1" [LSTM/rnn.cpp:79]   --->   Operation 102 'ddiv' 'tmp_2' <Predicate = (!icmp_ln76)> <Delay = 8.62> <Core = "DDiv">   --->   Core 117 'DDiv' <Latency = 30> <II = 1> <Delay = 8.62> <FuncUnit> <Opcode : 'ddiv' 'drem'> <InPorts = 2> <OutPorts = 1>

State 31 <SV = 30> <Delay = 8.62>
ST_31 : Operation 103 [28/31] (8.62ns)   --->   "%tmp_2 = fdiv double 1.000000e+00, %tmp_1" [LSTM/rnn.cpp:79]   --->   Operation 103 'ddiv' 'tmp_2' <Predicate = (!icmp_ln76)> <Delay = 8.62> <Core = "DDiv">   --->   Core 117 'DDiv' <Latency = 30> <II = 1> <Delay = 8.62> <FuncUnit> <Opcode : 'ddiv' 'drem'> <InPorts = 2> <OutPorts = 1>

State 32 <SV = 31> <Delay = 8.62>
ST_32 : Operation 104 [27/31] (8.62ns)   --->   "%tmp_2 = fdiv double 1.000000e+00, %tmp_1" [LSTM/rnn.cpp:79]   --->   Operation 104 'ddiv' 'tmp_2' <Predicate = (!icmp_ln76)> <Delay = 8.62> <Core = "DDiv">   --->   Core 117 'DDiv' <Latency = 30> <II = 1> <Delay = 8.62> <FuncUnit> <Opcode : 'ddiv' 'drem'> <InPorts = 2> <OutPorts = 1>

State 33 <SV = 32> <Delay = 8.62>
ST_33 : Operation 105 [26/31] (8.62ns)   --->   "%tmp_2 = fdiv double 1.000000e+00, %tmp_1" [LSTM/rnn.cpp:79]   --->   Operation 105 'ddiv' 'tmp_2' <Predicate = (!icmp_ln76)> <Delay = 8.62> <Core = "DDiv">   --->   Core 117 'DDiv' <Latency = 30> <II = 1> <Delay = 8.62> <FuncUnit> <Opcode : 'ddiv' 'drem'> <InPorts = 2> <OutPorts = 1>

State 34 <SV = 33> <Delay = 8.62>
ST_34 : Operation 106 [25/31] (8.62ns)   --->   "%tmp_2 = fdiv double 1.000000e+00, %tmp_1" [LSTM/rnn.cpp:79]   --->   Operation 106 'ddiv' 'tmp_2' <Predicate = (!icmp_ln76)> <Delay = 8.62> <Core = "DDiv">   --->   Core 117 'DDiv' <Latency = 30> <II = 1> <Delay = 8.62> <FuncUnit> <Opcode : 'ddiv' 'drem'> <InPorts = 2> <OutPorts = 1>

State 35 <SV = 34> <Delay = 8.62>
ST_35 : Operation 107 [24/31] (8.62ns)   --->   "%tmp_2 = fdiv double 1.000000e+00, %tmp_1" [LSTM/rnn.cpp:79]   --->   Operation 107 'ddiv' 'tmp_2' <Predicate = (!icmp_ln76)> <Delay = 8.62> <Core = "DDiv">   --->   Core 117 'DDiv' <Latency = 30> <II = 1> <Delay = 8.62> <FuncUnit> <Opcode : 'ddiv' 'drem'> <InPorts = 2> <OutPorts = 1>

State 36 <SV = 35> <Delay = 8.62>
ST_36 : Operation 108 [23/31] (8.62ns)   --->   "%tmp_2 = fdiv double 1.000000e+00, %tmp_1" [LSTM/rnn.cpp:79]   --->   Operation 108 'ddiv' 'tmp_2' <Predicate = (!icmp_ln76)> <Delay = 8.62> <Core = "DDiv">   --->   Core 117 'DDiv' <Latency = 30> <II = 1> <Delay = 8.62> <FuncUnit> <Opcode : 'ddiv' 'drem'> <InPorts = 2> <OutPorts = 1>

State 37 <SV = 36> <Delay = 8.62>
ST_37 : Operation 109 [22/31] (8.62ns)   --->   "%tmp_2 = fdiv double 1.000000e+00, %tmp_1" [LSTM/rnn.cpp:79]   --->   Operation 109 'ddiv' 'tmp_2' <Predicate = (!icmp_ln76)> <Delay = 8.62> <Core = "DDiv">   --->   Core 117 'DDiv' <Latency = 30> <II = 1> <Delay = 8.62> <FuncUnit> <Opcode : 'ddiv' 'drem'> <InPorts = 2> <OutPorts = 1>

State 38 <SV = 37> <Delay = 8.62>
ST_38 : Operation 110 [21/31] (8.62ns)   --->   "%tmp_2 = fdiv double 1.000000e+00, %tmp_1" [LSTM/rnn.cpp:79]   --->   Operation 110 'ddiv' 'tmp_2' <Predicate = (!icmp_ln76)> <Delay = 8.62> <Core = "DDiv">   --->   Core 117 'DDiv' <Latency = 30> <II = 1> <Delay = 8.62> <FuncUnit> <Opcode : 'ddiv' 'drem'> <InPorts = 2> <OutPorts = 1>

State 39 <SV = 38> <Delay = 8.62>
ST_39 : Operation 111 [20/31] (8.62ns)   --->   "%tmp_2 = fdiv double 1.000000e+00, %tmp_1" [LSTM/rnn.cpp:79]   --->   Operation 111 'ddiv' 'tmp_2' <Predicate = (!icmp_ln76)> <Delay = 8.62> <Core = "DDiv">   --->   Core 117 'DDiv' <Latency = 30> <II = 1> <Delay = 8.62> <FuncUnit> <Opcode : 'ddiv' 'drem'> <InPorts = 2> <OutPorts = 1>

State 40 <SV = 39> <Delay = 8.62>
ST_40 : Operation 112 [19/31] (8.62ns)   --->   "%tmp_2 = fdiv double 1.000000e+00, %tmp_1" [LSTM/rnn.cpp:79]   --->   Operation 112 'ddiv' 'tmp_2' <Predicate = (!icmp_ln76)> <Delay = 8.62> <Core = "DDiv">   --->   Core 117 'DDiv' <Latency = 30> <II = 1> <Delay = 8.62> <FuncUnit> <Opcode : 'ddiv' 'drem'> <InPorts = 2> <OutPorts = 1>

State 41 <SV = 40> <Delay = 8.62>
ST_41 : Operation 113 [18/31] (8.62ns)   --->   "%tmp_2 = fdiv double 1.000000e+00, %tmp_1" [LSTM/rnn.cpp:79]   --->   Operation 113 'ddiv' 'tmp_2' <Predicate = (!icmp_ln76)> <Delay = 8.62> <Core = "DDiv">   --->   Core 117 'DDiv' <Latency = 30> <II = 1> <Delay = 8.62> <FuncUnit> <Opcode : 'ddiv' 'drem'> <InPorts = 2> <OutPorts = 1>

State 42 <SV = 41> <Delay = 8.62>
ST_42 : Operation 114 [17/31] (8.62ns)   --->   "%tmp_2 = fdiv double 1.000000e+00, %tmp_1" [LSTM/rnn.cpp:79]   --->   Operation 114 'ddiv' 'tmp_2' <Predicate = (!icmp_ln76)> <Delay = 8.62> <Core = "DDiv">   --->   Core 117 'DDiv' <Latency = 30> <II = 1> <Delay = 8.62> <FuncUnit> <Opcode : 'ddiv' 'drem'> <InPorts = 2> <OutPorts = 1>

State 43 <SV = 42> <Delay = 8.62>
ST_43 : Operation 115 [16/31] (8.62ns)   --->   "%tmp_2 = fdiv double 1.000000e+00, %tmp_1" [LSTM/rnn.cpp:79]   --->   Operation 115 'ddiv' 'tmp_2' <Predicate = (!icmp_ln76)> <Delay = 8.62> <Core = "DDiv">   --->   Core 117 'DDiv' <Latency = 30> <II = 1> <Delay = 8.62> <FuncUnit> <Opcode : 'ddiv' 'drem'> <InPorts = 2> <OutPorts = 1>

State 44 <SV = 43> <Delay = 8.62>
ST_44 : Operation 116 [15/31] (8.62ns)   --->   "%tmp_2 = fdiv double 1.000000e+00, %tmp_1" [LSTM/rnn.cpp:79]   --->   Operation 116 'ddiv' 'tmp_2' <Predicate = (!icmp_ln76)> <Delay = 8.62> <Core = "DDiv">   --->   Core 117 'DDiv' <Latency = 30> <II = 1> <Delay = 8.62> <FuncUnit> <Opcode : 'ddiv' 'drem'> <InPorts = 2> <OutPorts = 1>

State 45 <SV = 44> <Delay = 8.62>
ST_45 : Operation 117 [14/31] (8.62ns)   --->   "%tmp_2 = fdiv double 1.000000e+00, %tmp_1" [LSTM/rnn.cpp:79]   --->   Operation 117 'ddiv' 'tmp_2' <Predicate = (!icmp_ln76)> <Delay = 8.62> <Core = "DDiv">   --->   Core 117 'DDiv' <Latency = 30> <II = 1> <Delay = 8.62> <FuncUnit> <Opcode : 'ddiv' 'drem'> <InPorts = 2> <OutPorts = 1>

State 46 <SV = 45> <Delay = 8.62>
ST_46 : Operation 118 [13/31] (8.62ns)   --->   "%tmp_2 = fdiv double 1.000000e+00, %tmp_1" [LSTM/rnn.cpp:79]   --->   Operation 118 'ddiv' 'tmp_2' <Predicate = (!icmp_ln76)> <Delay = 8.62> <Core = "DDiv">   --->   Core 117 'DDiv' <Latency = 30> <II = 1> <Delay = 8.62> <FuncUnit> <Opcode : 'ddiv' 'drem'> <InPorts = 2> <OutPorts = 1>

State 47 <SV = 46> <Delay = 8.62>
ST_47 : Operation 119 [12/31] (8.62ns)   --->   "%tmp_2 = fdiv double 1.000000e+00, %tmp_1" [LSTM/rnn.cpp:79]   --->   Operation 119 'ddiv' 'tmp_2' <Predicate = (!icmp_ln76)> <Delay = 8.62> <Core = "DDiv">   --->   Core 117 'DDiv' <Latency = 30> <II = 1> <Delay = 8.62> <FuncUnit> <Opcode : 'ddiv' 'drem'> <InPorts = 2> <OutPorts = 1>

State 48 <SV = 47> <Delay = 8.62>
ST_48 : Operation 120 [11/31] (8.62ns)   --->   "%tmp_2 = fdiv double 1.000000e+00, %tmp_1" [LSTM/rnn.cpp:79]   --->   Operation 120 'ddiv' 'tmp_2' <Predicate = (!icmp_ln76)> <Delay = 8.62> <Core = "DDiv">   --->   Core 117 'DDiv' <Latency = 30> <II = 1> <Delay = 8.62> <FuncUnit> <Opcode : 'ddiv' 'drem'> <InPorts = 2> <OutPorts = 1>

State 49 <SV = 48> <Delay = 8.62>
ST_49 : Operation 121 [10/31] (8.62ns)   --->   "%tmp_2 = fdiv double 1.000000e+00, %tmp_1" [LSTM/rnn.cpp:79]   --->   Operation 121 'ddiv' 'tmp_2' <Predicate = (!icmp_ln76)> <Delay = 8.62> <Core = "DDiv">   --->   Core 117 'DDiv' <Latency = 30> <II = 1> <Delay = 8.62> <FuncUnit> <Opcode : 'ddiv' 'drem'> <InPorts = 2> <OutPorts = 1>

State 50 <SV = 49> <Delay = 8.62>
ST_50 : Operation 122 [9/31] (8.62ns)   --->   "%tmp_2 = fdiv double 1.000000e+00, %tmp_1" [LSTM/rnn.cpp:79]   --->   Operation 122 'ddiv' 'tmp_2' <Predicate = (!icmp_ln76)> <Delay = 8.62> <Core = "DDiv">   --->   Core 117 'DDiv' <Latency = 30> <II = 1> <Delay = 8.62> <FuncUnit> <Opcode : 'ddiv' 'drem'> <InPorts = 2> <OutPorts = 1>

State 51 <SV = 50> <Delay = 8.62>
ST_51 : Operation 123 [8/31] (8.62ns)   --->   "%tmp_2 = fdiv double 1.000000e+00, %tmp_1" [LSTM/rnn.cpp:79]   --->   Operation 123 'ddiv' 'tmp_2' <Predicate = (!icmp_ln76)> <Delay = 8.62> <Core = "DDiv">   --->   Core 117 'DDiv' <Latency = 30> <II = 1> <Delay = 8.62> <FuncUnit> <Opcode : 'ddiv' 'drem'> <InPorts = 2> <OutPorts = 1>

State 52 <SV = 51> <Delay = 8.62>
ST_52 : Operation 124 [7/31] (8.62ns)   --->   "%tmp_2 = fdiv double 1.000000e+00, %tmp_1" [LSTM/rnn.cpp:79]   --->   Operation 124 'ddiv' 'tmp_2' <Predicate = (!icmp_ln76)> <Delay = 8.62> <Core = "DDiv">   --->   Core 117 'DDiv' <Latency = 30> <II = 1> <Delay = 8.62> <FuncUnit> <Opcode : 'ddiv' 'drem'> <InPorts = 2> <OutPorts = 1>

State 53 <SV = 52> <Delay = 8.62>
ST_53 : Operation 125 [6/31] (8.62ns)   --->   "%tmp_2 = fdiv double 1.000000e+00, %tmp_1" [LSTM/rnn.cpp:79]   --->   Operation 125 'ddiv' 'tmp_2' <Predicate = (!icmp_ln76)> <Delay = 8.62> <Core = "DDiv">   --->   Core 117 'DDiv' <Latency = 30> <II = 1> <Delay = 8.62> <FuncUnit> <Opcode : 'ddiv' 'drem'> <InPorts = 2> <OutPorts = 1>

State 54 <SV = 53> <Delay = 8.62>
ST_54 : Operation 126 [5/31] (8.62ns)   --->   "%tmp_2 = fdiv double 1.000000e+00, %tmp_1" [LSTM/rnn.cpp:79]   --->   Operation 126 'ddiv' 'tmp_2' <Predicate = (!icmp_ln76)> <Delay = 8.62> <Core = "DDiv">   --->   Core 117 'DDiv' <Latency = 30> <II = 1> <Delay = 8.62> <FuncUnit> <Opcode : 'ddiv' 'drem'> <InPorts = 2> <OutPorts = 1>

State 55 <SV = 54> <Delay = 8.62>
ST_55 : Operation 127 [4/31] (8.62ns)   --->   "%tmp_2 = fdiv double 1.000000e+00, %tmp_1" [LSTM/rnn.cpp:79]   --->   Operation 127 'ddiv' 'tmp_2' <Predicate = (!icmp_ln76)> <Delay = 8.62> <Core = "DDiv">   --->   Core 117 'DDiv' <Latency = 30> <II = 1> <Delay = 8.62> <FuncUnit> <Opcode : 'ddiv' 'drem'> <InPorts = 2> <OutPorts = 1>

State 56 <SV = 55> <Delay = 8.62>
ST_56 : Operation 128 [3/31] (8.62ns)   --->   "%tmp_2 = fdiv double 1.000000e+00, %tmp_1" [LSTM/rnn.cpp:79]   --->   Operation 128 'ddiv' 'tmp_2' <Predicate = (!icmp_ln76)> <Delay = 8.62> <Core = "DDiv">   --->   Core 117 'DDiv' <Latency = 30> <II = 1> <Delay = 8.62> <FuncUnit> <Opcode : 'ddiv' 'drem'> <InPorts = 2> <OutPorts = 1>

State 57 <SV = 56> <Delay = 8.62>
ST_57 : Operation 129 [2/31] (8.62ns)   --->   "%tmp_2 = fdiv double 1.000000e+00, %tmp_1" [LSTM/rnn.cpp:79]   --->   Operation 129 'ddiv' 'tmp_2' <Predicate = (!icmp_ln76)> <Delay = 8.62> <Core = "DDiv">   --->   Core 117 'DDiv' <Latency = 30> <II = 1> <Delay = 8.62> <FuncUnit> <Opcode : 'ddiv' 'drem'> <InPorts = 2> <OutPorts = 1>

State 58 <SV = 57> <Delay = 8.62>
ST_58 : Operation 130 [1/31] (8.62ns)   --->   "%tmp_2 = fdiv double 1.000000e+00, %tmp_1" [LSTM/rnn.cpp:79]   --->   Operation 130 'ddiv' 'tmp_2' <Predicate = (!icmp_ln76)> <Delay = 8.62> <Core = "DDiv">   --->   Core 117 'DDiv' <Latency = 30> <II = 1> <Delay = 8.62> <FuncUnit> <Opcode : 'ddiv' 'drem'> <InPorts = 2> <OutPorts = 1>

State 59 <SV = 58> <Delay = 5.20>
ST_59 : Operation 131 [2/2] (5.20ns)   --->   "%tmp_3 = fptrunc double %tmp_2 to float" [LSTM/rnn.cpp:79]   --->   Operation 131 'fptrunc' 'tmp_3' <Predicate = (!icmp_ln76)> <Delay = 5.20> <Core = "Double2Float">   --->   Core 123 'Double2Float' <Latency = 1> <II = 1> <Delay = 5.20> <FuncUnit> <Opcode : 'fptrunc'> <InPorts = 1> <OutPorts = 1>

State 60 <SV = 59> <Delay = 8.45>
ST_60 : Operation 132 [1/1] (0.00ns)   --->   "call void (...)* @_ssdm_op_SpecLoopName([7 x i8]* @p_str410) nounwind" [LSTM/rnn.cpp:77]   --->   Operation 132 'specloopname' <Predicate = (!icmp_ln76)> <Delay = 0.00>
ST_60 : Operation 133 [1/1] (0.00ns)   --->   "%tmp_4 = call i32 (...)* @_ssdm_op_SpecRegionBegin([7 x i8]* @p_str410)" [LSTM/rnn.cpp:77]   --->   Operation 133 'specregionbegin' 'tmp_4' <Predicate = (!icmp_ln76)> <Delay = 0.00>
ST_60 : Operation 134 [1/1] (0.00ns)   --->   "call void (...)* @_ssdm_op_SpecPipeline(i32 -1, i32 1, i32 1, i32 0, [1 x i8]* @p_str28) nounwind" [LSTM/rnn.cpp:78]   --->   Operation 134 'specpipeline' <Predicate = (!icmp_ln76)> <Delay = 0.00>
ST_60 : Operation 135 [1/2] (5.20ns)   --->   "%tmp_3 = fptrunc double %tmp_2 to float" [LSTM/rnn.cpp:79]   --->   Operation 135 'fptrunc' 'tmp_3' <Predicate = (!icmp_ln76)> <Delay = 5.20> <Core = "Double2Float">   --->   Core 123 'Double2Float' <Latency = 1> <II = 1> <Delay = 5.20> <FuncUnit> <Opcode : 'fptrunc'> <InPorts = 1> <OutPorts = 1>
ST_60 : Operation 136 [1/1] (0.00ns)   --->   "%res_addr = getelementptr [64 x float]* %res, i64 0, i64 %zext_ln79" [LSTM/rnn.cpp:79]   --->   Operation 136 'getelementptr' 'res_addr' <Predicate = (!icmp_ln76)> <Delay = 0.00>
ST_60 : Operation 137 [1/1] (3.25ns)   --->   "store float %tmp_3, float* %res_addr, align 4" [LSTM/rnn.cpp:79]   --->   Operation 137 'store' <Predicate = (!icmp_ln76)> <Delay = 3.25> <Core = "RAM">   --->   Core 37 'RAM' <Latency = 1> <II = 1> <Delay = 3.25> <Storage> <Opcode : 'load' 'store'> <Ports = 2> <Width = 32> <Depth = 64> <RAM>
ST_60 : Operation 138 [1/1] (0.00ns)   --->   "%empty_5 = call i32 (...)* @_ssdm_op_SpecRegionEnd([7 x i8]* @p_str410, i32 %tmp_4)" [LSTM/rnn.cpp:80]   --->   Operation 138 'specregionend' 'empty_5' <Predicate = (!icmp_ln76)> <Delay = 0.00>
ST_60 : Operation 139 [1/1] (0.00ns)   --->   "br label %1" [LSTM/rnn.cpp:76]   --->   Operation 139 'br' <Predicate = (!icmp_ln76)> <Delay = 0.00>

State 61 <SV = 2> <Delay = 0.00>
ST_61 : Operation 140 [1/1] (0.00ns)   --->   "ret void" [LSTM/rnn.cpp:81]   --->   Operation 140 'ret' <Predicate = true> <Delay = 0.00>


============================================================
+ Verbose Summary: Timing violations
============================================================
Target clock period: 10ns, clock uncertainty: 1.25ns.

 <State 1>: 1.77ns
The critical path consists of the following:
	multiplexor before 'phi' operation ('i') with incoming values : ('i', LSTM/rnn.cpp:76) [5]  (1.77 ns)

 <State 2>: 3.25ns
The critical path consists of the following:
	'phi' operation ('i') with incoming values : ('i', LSTM/rnn.cpp:76) [5]  (0 ns)
	'getelementptr' operation ('a_addr', LSTM/rnn.cpp:79) [15]  (0 ns)
	'load' operation ('a_load', LSTM/rnn.cpp:79) on array 'a' [16]  (3.25 ns)

 <State 3>: 8.68ns
The critical path consists of the following:
	'load' operation ('a_load', LSTM/rnn.cpp:79) on array 'a' [16]  (3.25 ns)
	'xor' operation ('xor_ln79', LSTM/rnn.cpp:79) [18]  (0.993 ns)
	'fpext' operation ('tmp_9', LSTM/rnn.cpp:79) [20]  (4.44 ns)

 <State 4>: 4.44ns
The critical path consists of the following:
	'fpext' operation ('tmp_9', LSTM/rnn.cpp:79) [20]  (4.44 ns)

 <State 5>: 7.32ns
The critical path consists of the following:
	'dexp' operation ('tmp_s', LSTM/rnn.cpp:79) [21]  (7.32 ns)

 <State 6>: 7.32ns
The critical path consists of the following:
	'dexp' operation ('tmp_s', LSTM/rnn.cpp:79) [21]  (7.32 ns)

 <State 7>: 7.32ns
The critical path consists of the following:
	'dexp' operation ('tmp_s', LSTM/rnn.cpp:79) [21]  (7.32 ns)

 <State 8>: 7.32ns
The critical path consists of the following:
	'dexp' operation ('tmp_s', LSTM/rnn.cpp:79) [21]  (7.32 ns)

 <State 9>: 7.32ns
The critical path consists of the following:
	'dexp' operation ('tmp_s', LSTM/rnn.cpp:79) [21]  (7.32 ns)

 <State 10>: 7.32ns
The critical path consists of the following:
	'dexp' operation ('tmp_s', LSTM/rnn.cpp:79) [21]  (7.32 ns)

 <State 11>: 7.32ns
The critical path consists of the following:
	'dexp' operation ('tmp_s', LSTM/rnn.cpp:79) [21]  (7.32 ns)

 <State 12>: 7.32ns
The critical path consists of the following:
	'dexp' operation ('tmp_s', LSTM/rnn.cpp:79) [21]  (7.32 ns)

 <State 13>: 7.32ns
The critical path consists of the following:
	'dexp' operation ('tmp_s', LSTM/rnn.cpp:79) [21]  (7.32 ns)

 <State 14>: 7.32ns
The critical path consists of the following:
	'dexp' operation ('tmp_s', LSTM/rnn.cpp:79) [21]  (7.32 ns)

 <State 15>: 7.32ns
The critical path consists of the following:
	'dexp' operation ('tmp_s', LSTM/rnn.cpp:79) [21]  (7.32 ns)

 <State 16>: 7.32ns
The critical path consists of the following:
	'dexp' operation ('tmp_s', LSTM/rnn.cpp:79) [21]  (7.32 ns)

 <State 17>: 7.32ns
The critical path consists of the following:
	'dexp' operation ('tmp_s', LSTM/rnn.cpp:79) [21]  (7.32 ns)

 <State 18>: 7.32ns
The critical path consists of the following:
	'dexp' operation ('tmp_s', LSTM/rnn.cpp:79) [21]  (7.32 ns)

 <State 19>: 7.32ns
The critical path consists of the following:
	'dexp' operation ('tmp_s', LSTM/rnn.cpp:79) [21]  (7.32 ns)

 <State 20>: 7.32ns
The critical path consists of the following:
	'dexp' operation ('tmp_s', LSTM/rnn.cpp:79) [21]  (7.32 ns)

 <State 21>: 7.32ns
The critical path consists of the following:
	'dexp' operation ('tmp_s', LSTM/rnn.cpp:79) [21]  (7.32 ns)

 <State 22>: 7.32ns
The critical path consists of the following:
	'dexp' operation ('tmp_s', LSTM/rnn.cpp:79) [21]  (7.32 ns)

 <State 23>: 8.23ns
The critical path consists of the following:
	'dadd' operation ('tmp_1', LSTM/rnn.cpp:79) [22]  (8.23 ns)

 <State 24>: 8.23ns
The critical path consists of the following:
	'dadd' operation ('tmp_1', LSTM/rnn.cpp:79) [22]  (8.23 ns)

 <State 25>: 8.23ns
The critical path consists of the following:
	'dadd' operation ('tmp_1', LSTM/rnn.cpp:79) [22]  (8.23 ns)

 <State 26>: 8.23ns
The critical path consists of the following:
	'dadd' operation ('tmp_1', LSTM/rnn.cpp:79) [22]  (8.23 ns)

 <State 27>: 8.23ns
The critical path consists of the following:
	'dadd' operation ('tmp_1', LSTM/rnn.cpp:79) [22]  (8.23 ns)

 <State 28>: 8.62ns
The critical path consists of the following:
	'ddiv' operation ('tmp_2', LSTM/rnn.cpp:79) [23]  (8.62 ns)

 <State 29>: 8.62ns
The critical path consists of the following:
	'ddiv' operation ('tmp_2', LSTM/rnn.cpp:79) [23]  (8.62 ns)

 <State 30>: 8.62ns
The critical path consists of the following:
	'ddiv' operation ('tmp_2', LSTM/rnn.cpp:79) [23]  (8.62 ns)

 <State 31>: 8.62ns
The critical path consists of the following:
	'ddiv' operation ('tmp_2', LSTM/rnn.cpp:79) [23]  (8.62 ns)

 <State 32>: 8.62ns
The critical path consists of the following:
	'ddiv' operation ('tmp_2', LSTM/rnn.cpp:79) [23]  (8.62 ns)

 <State 33>: 8.62ns
The critical path consists of the following:
	'ddiv' operation ('tmp_2', LSTM/rnn.cpp:79) [23]  (8.62 ns)

 <State 34>: 8.62ns
The critical path consists of the following:
	'ddiv' operation ('tmp_2', LSTM/rnn.cpp:79) [23]  (8.62 ns)

 <State 35>: 8.62ns
The critical path consists of the following:
	'ddiv' operation ('tmp_2', LSTM/rnn.cpp:79) [23]  (8.62 ns)

 <State 36>: 8.62ns
The critical path consists of the following:
	'ddiv' operation ('tmp_2', LSTM/rnn.cpp:79) [23]  (8.62 ns)

 <State 37>: 8.62ns
The critical path consists of the following:
	'ddiv' operation ('tmp_2', LSTM/rnn.cpp:79) [23]  (8.62 ns)

 <State 38>: 8.62ns
The critical path consists of the following:
	'ddiv' operation ('tmp_2', LSTM/rnn.cpp:79) [23]  (8.62 ns)

 <State 39>: 8.62ns
The critical path consists of the following:
	'ddiv' operation ('tmp_2', LSTM/rnn.cpp:79) [23]  (8.62 ns)

 <State 40>: 8.62ns
The critical path consists of the following:
	'ddiv' operation ('tmp_2', LSTM/rnn.cpp:79) [23]  (8.62 ns)

 <State 41>: 8.62ns
The critical path consists of the following:
	'ddiv' operation ('tmp_2', LSTM/rnn.cpp:79) [23]  (8.62 ns)

 <State 42>: 8.62ns
The critical path consists of the following:
	'ddiv' operation ('tmp_2', LSTM/rnn.cpp:79) [23]  (8.62 ns)

 <State 43>: 8.62ns
The critical path consists of the following:
	'ddiv' operation ('tmp_2', LSTM/rnn.cpp:79) [23]  (8.62 ns)

 <State 44>: 8.62ns
The critical path consists of the following:
	'ddiv' operation ('tmp_2', LSTM/rnn.cpp:79) [23]  (8.62 ns)

 <State 45>: 8.62ns
The critical path consists of the following:
	'ddiv' operation ('tmp_2', LSTM/rnn.cpp:79) [23]  (8.62 ns)

 <State 46>: 8.62ns
The critical path consists of the following:
	'ddiv' operation ('tmp_2', LSTM/rnn.cpp:79) [23]  (8.62 ns)

 <State 47>: 8.62ns
The critical path consists of the following:
	'ddiv' operation ('tmp_2', LSTM/rnn.cpp:79) [23]  (8.62 ns)

 <State 48>: 8.62ns
The critical path consists of the following:
	'ddiv' operation ('tmp_2', LSTM/rnn.cpp:79) [23]  (8.62 ns)

 <State 49>: 8.62ns
The critical path consists of the following:
	'ddiv' operation ('tmp_2', LSTM/rnn.cpp:79) [23]  (8.62 ns)

 <State 50>: 8.62ns
The critical path consists of the following:
	'ddiv' operation ('tmp_2', LSTM/rnn.cpp:79) [23]  (8.62 ns)

 <State 51>: 8.62ns
The critical path consists of the following:
	'ddiv' operation ('tmp_2', LSTM/rnn.cpp:79) [23]  (8.62 ns)

 <State 52>: 8.62ns
The critical path consists of the following:
	'ddiv' operation ('tmp_2', LSTM/rnn.cpp:79) [23]  (8.62 ns)

 <State 53>: 8.62ns
The critical path consists of the following:
	'ddiv' operation ('tmp_2', LSTM/rnn.cpp:79) [23]  (8.62 ns)

 <State 54>: 8.62ns
The critical path consists of the following:
	'ddiv' operation ('tmp_2', LSTM/rnn.cpp:79) [23]  (8.62 ns)

 <State 55>: 8.62ns
The critical path consists of the following:
	'ddiv' operation ('tmp_2', LSTM/rnn.cpp:79) [23]  (8.62 ns)

 <State 56>: 8.62ns
The critical path consists of the following:
	'ddiv' operation ('tmp_2', LSTM/rnn.cpp:79) [23]  (8.62 ns)

 <State 57>: 8.62ns
The critical path consists of the following:
	'ddiv' operation ('tmp_2', LSTM/rnn.cpp:79) [23]  (8.62 ns)

 <State 58>: 8.62ns
The critical path consists of the following:
	'ddiv' operation ('tmp_2', LSTM/rnn.cpp:79) [23]  (8.62 ns)

 <State 59>: 5.2ns
The critical path consists of the following:
	'fptrunc' operation ('tmp_3', LSTM/rnn.cpp:79) [24]  (5.2 ns)

 <State 60>: 8.46ns
The critical path consists of the following:
	'fptrunc' operation ('tmp_3', LSTM/rnn.cpp:79) [24]  (5.2 ns)
	'store' operation ('store_ln79', LSTM/rnn.cpp:79) of variable 'tmp_3', LSTM/rnn.cpp:79 on array 'res' [26]  (3.25 ns)

 <State 61>: 0ns
The critical path consists of the following:


============================================================
+ Verbose Summary: Binding
============================================================
N/A
* FSMD analyzer results:
  - Output states:
 - Input state : 
  - Chain level:
	State 1
	State 2
	State 3
	State 4
	State 5
	State 6
	State 7
	State 8
	State 9
	State 10
	State 11
	State 12
	State 13
	State 14
	State 15
	State 16
	State 17
	State 18
	State 19
	State 20
	State 21
	State 22
	State 23
	State 24
	State 25
	State 26
	State 27
	State 28
	State 29
	State 30
	State 31
	State 32
	State 33
	State 34
	State 35
	State 36
	State 37
	State 38
	State 39
	State 40
	State 41
	State 42
	State 43
	State 44
	State 45
	State 46
	State 47
	State 48
	State 49
	State 50
	State 51
	State 52
	State 53
	State 54
	State 55
	State 56
	State 57
	State 58
	State 59
	State 60
	State 61


============================================================
+ Verbose Summary: Datapath Resource usage 
============================================================
N/A
